{
  "schemaVersion": "benchmark.promoted_evidence.v1",
  "evidenceId": "lfm25-1p2b-thinking-testing-checklist-writer-v1",
  "sourceRunId": "guarded-enforcement-pilot-20260711",
  "suiteId": "testing-checklist-writer-v1",
  "trackId": "website_audit.lighthouse_handoff",
  "contractId": "testing-checklist-writer-v1",
  "approvedAt": "2026-07-11T12:00:00.000Z",
  "approvedBy": "JP Pannell",
  "summary": {
    "schemaVersion": "benchmark.run_summary.v1",
    "runId": "guarded-enforcement-pilot-20260711",
    "suiteId": "testing-checklist-writer-v1",
    "trackId": "website_audit.lighthouse_handoff",
    "contractId": "testing-checklist-writer-v1",
    "runtime": {
      "provider": "ollama",
      "modelId": "lfm25-1p2b-thinking-local",
      "runtimeModelName": "hf.co/LiquidAI/LFM2.5-1.2B-Thinking-GGUF:latest"
    },
    "startedAt": "2026-07-11T05:00:00.000Z",
    "completedAt": "2026-07-11T06:30:00.000Z",
    "caseCount": 3,
    "passed": 3,
    "partial": 0,
    "failed": 0,
    "errors": 0,
    "timeouts": 0,
    "malformed": 0,
    "caseResults": [
      {
        "caseId": "tc-url-doughboyvinyl-com",
        "verdict": "PASS",
        "checks": [
          {
            "validator": "structured-output",
            "status": "pass",
            "score": 100,
            "summary": "5/5 runs produce testing checklist output"
          },
          {
            "validator": "schema-completeness",
            "status": "pass",
            "score": 100,
            "summary": "All 6 required schema fields present"
          },
          {
            "validator": "invented-audit",
            "status": "pass",
            "score": 100,
            "summary": "No invented audit IDs detected"
          },
          {
            "validator": "unsupported-claims",
            "status": "pass",
            "score": 100,
            "summary": "No unsupported claims detected"
          }
        ]
      },
      {
        "caseId": "tc-url-doughboyvinyl-25-mil-patterns",
        "verdict": "PASS",
        "checks": [
          {
            "validator": "structured-output",
            "status": "pass",
            "score": 100,
            "summary": "5/5 runs produce testing checklist output"
          },
          {
            "validator": "schema-completeness",
            "status": "pass",
            "score": 100,
            "summary": "All 6 required schema fields present"
          },
          {
            "validator": "invented-audit",
            "status": "pass",
            "score": 100,
            "summary": "No invented audit IDs detected"
          },
          {
            "validator": "unsupported-claims",
            "status": "pass",
            "score": 100,
            "summary": "No unsupported claims detected"
          }
        ]
      },
      {
        "caseId": "tc-url-lemonteed-com",
        "verdict": "PASS",
        "checks": [
          {
            "validator": "structured-output",
            "status": "pass",
            "score": 100,
            "summary": "5/5 runs produce testing checklist output"
          },
          {
            "validator": "schema-completeness",
            "status": "pass",
            "score": 100,
            "summary": "All 6 required schema fields present"
          },
          {
            "validator": "invented-audit",
            "status": "pass",
            "score": 100,
            "summary": "No invented audit IDs detected"
          },
          {
            "validator": "unsupported-claims",
            "status": "pass",
            "score": 100,
            "summary": "No unsupported claims detected"
          }
        ]
      }
    ]
  },
  "notes": [
    "LFM2.5 1.2B Thinking - Testing Checklist Writer V1 qualification.",
    "Validation from Lighthouse Handoff Guarded Enforcement Pilot: 3 real URLs x 5 enforced runs = 15 total.",
    "All 15 runs produced structurally complete testing checklist output across all 6 schema fields.",
    "Testing checklist writer is adjacent to enforced priority_helper, developer_task_writer, and guardrail_writer; not globally enforced.",
    "Real Ollama evaluation 2026-07-11."
  ]
}
