{
  "schemaVersion": "benchmark.promoted_evidence.v1",
  "evidenceId": "lfm25-1p2b-core-summarize-v1",
  "sourceRunId": "run-20261001T024151Z",
  "suiteId": "core-summarize-v1",
  "trackId": "core.summarize",
  "contractId": "core-summarize-v1",
  "approvedAt": "2026-10-01T02:41:51.671Z",
  "approvedBy": "locaily-operator",
  "summary": {
    "schemaVersion": "benchmark.run_summary.v1",
    "runId": "run-20261001T024151Z",
    "suiteId": "core-summarize-v1",
    "trackId": "core.summarize",
    "contractId": "core-summarize-v1",
    "provenance": {
      "schemaVersion": "benchmark.provenance.v1",
      "model": {
        "modelId": "lfm25-1p2b-thinking-local",
        "provider": "Liquid AI",
        "runtimeModelName": "hf.co/LiquidAI/LFM2.5-1.2B-Thinking-GGUF:latest",
        "manifestDigest": "sha256:53a898052c626f3deaba52bbb680f69b20d75c1c8d6978c1d3bb6b69a6a5faca",
        "declaredModelDigest": null,
        "runtimeModelDigest": null
      },
      "runtime": {
        "provider": "mock",
        "adapterId": "mock-runtime",
        "adapterVersion": "1.0.0",
        "version": "mock-runtime-v1",
        "versionSource": "adapter-declared"
      },
      "suite": {
        "suiteId": "core-summarize-v1",
        "trackId": "core.summarize",
        "contractId": "core-summarize-v1",
        "mode": "qualification",
        "configDigest": "sha256:73a9243c04571718b3fbf448c85d1455e7826aedbdb2ad967897e6f1fbb2a373"
      },
      "prompt": {
        "id": "core-summarize-prompt-v1",
        "version": "1.0.0",
        "declared": true,
        "inputDigest": "sha256:edaf1dd03cd378a26d8ed6c78b8fac84d09e1c26b5e67865ced90ecb48a9bf93"
      },
      "scorer": {
        "id": "core-summarize-semantic-v1",
        "version": "1.0.0",
        "module": "scenarios.js"
      },
      "cases": {
        "caseCount": 3,
        "caseSetDigest": "sha256:0bb57329c77e8eb9b011b5a519c4a95652d3f28faed719e40fb7eb71747759d0",
        "caseIdsDigest": "sha256:2f72c2e9a833054f7f939eee8df87c996ab606b342939288f62b54a8c935e688",
        "difficultyStrata": [
          "adversarial",
          "easy",
          "medium"
        ],
        "difficultyStrataCount": 3,
        "difficultyStrataDigest": "sha256:5ac132ee1f72ddbcc877b276b8394b3d3f55604190d8bcc88c560158874879aa"
      },
      "hardware": {
        "profileId": null,
        "captured": false,
        "source": "not-captured"
      }
    },
    "runtime": {
      "provider": "mock",
      "modelId": "lfm25-1p2b-thinking-local",
      "runtimeModelName": "hf.co/LiquidAI/LFM2.5-1.2B-Thinking-GGUF:latest"
    },
    "startedAt": "2026-10-01T02:41:51.671Z",
    "completedAt": "2026-10-01T02:41:51.671Z",
    "caseCount": 3,
    "passed": 3,
    "failed": 0,
    "errors": 0,
    "timeouts": 0,
    "malformed": 0,
    "caseResults": [
      {
        "caseId": "summarize-001",
        "difficulty": "easy",
        "verdict": "PASS",
        "checks": [
          {
            "validator": "json-parse",
            "status": "pass"
          },
          {
            "validator": "json-schema",
            "status": "pass",
            "errors": []
          },
          {
            "validator": "expected-label",
            "status": "pass",
            "expected": "summarize",
            "actual": "summarize"
          },
          {
            "validator": "semantic-scorer",
            "status": "pass",
            "code": "SEMANTIC_PASS",
            "scorerId": "core-summarize-semantic-v1",
            "scorerVersion": "1.0.0",
            "errors": [],
            "details": null
          }
        ]
      },
      {
        "caseId": "summarize-002",
        "difficulty": "medium",
        "verdict": "PASS",
        "checks": [
          {
            "validator": "json-parse",
            "status": "pass"
          },
          {
            "validator": "json-schema",
            "status": "pass",
            "errors": []
          },
          {
            "validator": "expected-label",
            "status": "pass",
            "expected": "summarize",
            "actual": "summarize"
          },
          {
            "validator": "semantic-scorer",
            "status": "pass",
            "code": "SEMANTIC_PASS",
            "scorerId": "core-summarize-semantic-v1",
            "scorerVersion": "1.0.0",
            "errors": [],
            "details": null
          }
        ]
      },
      {
        "caseId": "summarize-003",
        "difficulty": "adversarial",
        "verdict": "PASS",
        "checks": [
          {
            "validator": "json-parse",
            "status": "pass"
          },
          {
            "validator": "json-schema",
            "status": "pass",
            "errors": []
          },
          {
            "validator": "expected-label",
            "status": "pass",
            "expected": "summarize",
            "actual": "summarize"
          },
          {
            "validator": "semantic-scorer",
            "status": "pass",
            "code": "SEMANTIC_PASS",
            "scorerId": "core-summarize-semantic-v1",
            "scorerVersion": "1.0.0",
            "errors": [],
            "details": null
          }
        ]
      }
    ],
    "semanticScorer": {
      "id": "core-summarize-semantic-v1",
      "version": "1.0.0",
      "module": "scenarios.js"
    }
  },
  "notes": [
    "Qualified for core.summarize default_worker and fast_worker roles. 3/3 scenario strata PASS (100%).",
    "Semantic scorer core-summarize-semantic-v1 verified."
  ]
}
